{"invariant":"raw_rows == kept + sum(exclusions) per service-month; unknown-zone rows stay in kept","rows":[{"exclusions":{"bad_distance":2919,"bad_duration":1728,"implausible_speed":16,"nonpositive_duration":2,"null_timestamp":0,"ts_out_of_month":0},"kept":19659265,"kept_known_od":18917693,"month":1,"raw_rows":19663930,"service":"fhvhv","trip_time_mismatch_gt60s":0,"unknown_do":741054,"unknown_od":741572,"unknown_pu":763},{"exclusions":{"bad_distance":2611,"bad_duration":1658,"implausible_speed":17,"nonpositive_duration":3,"null_timestamp":0,"ts_out_of_month":0},"kept":19354859,"kept_known_od":18600905,"month":2,"raw_rows":19359148,"service":"fhvhv","trip_time_mismatch_gt60s":0,"unknown_do":753444,"unknown_od":753954,"unknown_pu":733},{"exclusions":{"bad_distance":2698,"bad_duration":1457,"implausible_speed":13,"nonpositive_duration":2,"null_timestamp":0,"ts_out_of_month":0},"kept":21276618,"kept_known_od":20443179,"month":3,"raw_rows":21280788,"service":"fhvhv","trip_time_mismatch_gt60s":8592,"unknown_do":832903,"unknown_od":833439,"unknown_pu":795},{"exclusions":{"bad_distance":2276,"bad_duration":1476,"implausible_speed":17,"nonpositive_duration":1,"null_timestamp":0,"ts_out_of_month":0},"kept":19729268,"kept_known_od":18923313,"month":4,"raw_rows":19733038,"service":"fhvhv","trip_time_mismatch_gt60s":0,"unknown_do":805457,"unknown_od":805955,"unknown_pu":768},{"exclusions":{"bad_distance":2241,"bad_duration":1431,"implausible_speed":11,"nonpositive_duration":1,"null_timestamp":0,"ts_out_of_month":0},"kept":20700854,"kept_known_od":19827670,"month":5,"raw_rows":20704538,"service":"fhvhv","trip_time_mismatch_gt60s":0,"unknown_do":872610,"unknown_od":873184,"unknown_pu":840},{"exclusions":{"bad_distance":2418,"bad_duration":1369,"implausible_speed":9,"nonpositive_duration":3,"null_timestamp":0,"ts_out_of_month":0},"kept":20119427,"kept_known_od":19254655,"month":6,"raw_rows":20123226,"service":"fhvhv","trip_time_mismatch_gt60s":0,"unknown_do":864217,"unknown_od":864772,"unknown_pu":857},{"exclusions":{"bad_distance":2258,"bad_duration":1465,"implausible_speed":8,"nonpositive_duration":4,"null_timestamp":0,"ts_out_of_month":0},"kept":19179199,"kept_known_od":18370927,"month":7,"raw_rows":19182934,"service":"fhvhv","trip_time_mismatch_gt60s":0,"unknown_do":807770,"unknown_od":808272,"unknown_pu":805},{"exclusions":{"bad_distance":2413,"bad_duration":1337,"implausible_speed":18,"nonpositive_duration":3,"null_timestamp":0,"ts_out_of_month":0},"kept":19124621,"kept_known_od":18314082,"month":8,"raw_rows":19128392,"service":"fhvhv","trip_time_mismatch_gt60s":0,"unknown_do":810029,"unknown_od":810539,"unknown_pu":788},{"exclusions":{"bad_distance":2706,"bad_duration":1329,"implausible_speed":11,"nonpositive_duration":2,"null_timestamp":0,"ts_out_of_month":0},"kept":19205740,"kept_known_od":18357759,"month":9,"raw_rows":19209788,"service":"fhvhv","trip_time_mismatch_gt60s":0,"unknown_do":847506,"unknown_od":847981,"unknown_pu":740},{"exclusions":{"bad_distance":2678,"bad_duration":1304,"implausible_speed":4,"nonpositive_duration":1,"null_timestamp":0,"ts_out_of_month":0},"kept":20024295,"kept_known_od":19126921,"month":10,"raw_rows":20028282,"service":"fhvhv","trip_time_mismatch_gt60s":0,"unknown_do":896868,"unknown_od":897374,"unknown_pu":786},{"exclusions":{"bad_distance":2671,"bad_duration":1308,"implausible_speed":139,"nonpositive_duration":9655,"null_timestamp":0,"ts_out_of_month":0},"kept":19973760,"kept_known_od":19124474,"month":11,"raw_rows":19987533,"service":"fhvhv","trip_time_mismatch_gt60s":24,"unknown_do":848779,"unknown_od":849286,"unknown_pu":800},{"exclusions":{"bad_distance":2936,"bad_duration":1597,"implausible_speed":3,"nonpositive_duration":3,"null_timestamp":0,"ts_out_of_month":0},"kept":21064312,"kept_known_od":20135229,"month":12,"raw_rows":21068851,"service":"fhvhv","trip_time_mismatch_gt60s":0,"unknown_do":928583,"unknown_od":929083,"unknown_pu":754},{"exclusions":{"bad_distance":1909,"bad_duration":1742,"implausible_speed":10,"nonpositive_duration":76,"null_timestamp":0,"ts_out_of_month":2},"kept":52812,"kept_known_od":52520,"month":1,"raw_rows":56551,"service":"green","trip_time_mismatch_gt60s":0,"unknown_do":252,"unknown_od":292,"unknown_pu":56},{"exclusions":{"bad_distance":1891,"bad_duration":1651,"implausible_speed":5,"nonpositive_duration":48,"null_timestamp":0,"ts_out_of_month":6},"kept":49976,"kept_known_od":49701,"month":2,"raw_rows":53577,"service":"green","trip_time_mismatch_gt60s":0,"unknown_do":245,"unknown_od":275,"unknown_pu":55},{"exclusions":{"bad_distance":1961,"bad_duration":1776,"implausible_speed":11,"nonpositive_duration":34,"null_timestamp":0,"ts_out_of_month":10},"kept":53665,"kept_known_od":53385,"month":3,"raw_rows":57457,"service":"green","trip_time_mismatch_gt60s":0,"unknown_do":254,"unknown_od":280,"unknown_pu":49},{"exclusions":{"bad_distance":2093,"bad_duration":1871,"implausible_speed":13,"nonpositive_duration":70,"null_timestamp":0,"ts_out_of_month":4},"kept":52420,"kept_known_od":52166,"month":4,"raw_rows":56471,"service":"green","trip_time_mismatch_gt60s":0,"unknown_do":237,"unknown_od":254,"unknown_pu":29},{"exclusions":{"bad_distance":1933,"bad_duration":2084,"implausible_speed":11,"nonpositive_duration":53,"null_timestamp":0,"ts_out_of_month":9},"kept":56913,"kept_known_od":56635,"month":5,"raw_rows":61003,"service":"green","trip_time_mismatch_gt60s":0,"unknown_do":260,"unknown_od":278,"unknown_pu":43},{"exclusions":{"bad_distance":1624,"bad_duration":1880,"implausible_speed":14,"nonpositive_duration":54,"null_timestamp":0,"ts_out_of_month":13},"kept":51163,"kept_known_od":50832,"month":6,"raw_rows":54748,"service":"green","trip_time_mismatch_gt60s":0,"unknown_do":308,"unknown_od":331,"unknown_pu":41},{"exclusions":{"bad_distance":1771,"bad_duration":1917,"implausible_speed":19,"nonpositive_duration":58,"null_timestamp":0,"ts_out_of_month":26},"kept":48046,"kept_known_od":47731,"month":7,"raw_rows":51837,"service":"green","trip_time_mismatch_gt60s":0,"unknown_do":292,"unknown_od":315,"unknown_pu":46},{"exclusions":{"bad_distance":1568,"bad_duration":1990,"implausible_speed":22,"nonpositive_duration":53,"null_timestamp":0,"ts_out_of_month":20},"kept":48118,"kept_known_od":47734,"month":8,"raw_rows":51771,"service":"green","trip_time_mismatch_gt60s":0,"unknown_do":353,"unknown_od":384,"unknown_pu":51},{"exclusions":{"bad_distance":1625,"bad_duration":1986,"implausible_speed":16,"nonpositive_duration":62,"null_timestamp":0,"ts_out_of_month":34},"kept":50717,"kept_known_od":50305,"month":9,"raw_rows":54440,"service":"green","trip_time_mismatch_gt60s":0,"unknown_do":382,"unknown_od":412,"unknown_pu":56},{"exclusions":{"bad_distance":1487,"bad_duration":1927,"implausible_speed":12,"nonpositive_duration":51,"null_timestamp":0,"ts_out_of_month":7},"kept":52663,"kept_known_od":52302,"month":10,"raw_rows":56147,"service":"green","trip_time_mismatch_gt60s":0,"unknown_do":337,"unknown_od":361,"unknown_pu":50},{"exclusions":{"bad_distance":1744,"bad_duration":1781,"implausible_speed":8,"nonpositive_duration":41,"null_timestamp":0,"ts_out_of_month":15},"kept":48633,"kept_known_od":48349,"month":11,"raw_rows":52222,"service":"green","trip_time_mismatch_gt60s":0,"unknown_do":252,"unknown_od":284,"unknown_pu":52},{"exclusions":{"bad_distance":1789,"bad_duration":1992,"implausible_speed":17,"nonpositive_duration":60,"null_timestamp":0,"ts_out_of_month":18},"kept":50118,"kept_known_od":49821,"month":12,"raw_rows":53994,"service":"green","trip_time_mismatch_gt60s":0,"unknown_do":273,"unknown_od":297,"unknown_pu":44},{"exclusions":{"bad_distance":36256,"bad_duration":36023,"implausible_speed":102,"nonpositive_duration":870,"null_timestamp":0,"ts_out_of_month":18},"kept":2891355,"kept_known_od":2863424,"month":1,"raw_rows":2964624,"service":"yellow","trip_time_mismatch_gt60s":0,"unknown_do":24682,"unknown_od":27931,"unknown_pu":10024},{"exclusions":{"bad_distance":45026,"bad_duration":34676,"implausible_speed":74,"nonpositive_duration":803,"null_timestamp":0,"ts_out_of_month":15},"kept":2926932,"kept_known_od":2901178,"month":2,"raw_rows":3007526,"service":"yellow","trip_time_mismatch_gt60s":0,"unknown_do":22791,"unknown_od":25754,"unknown_pu":9328},{"exclusions":{"bad_distance":59642,"bad_duration":41457,"implausible_speed":97,"nonpositive_duration":1128,"null_timestamp":0,"ts_out_of_month":23},"kept":3480281,"kept_known_od":3449132,"month":3,"raw_rows":3582628,"service":"yellow","trip_time_mismatch_gt60s":0,"unknown_do":27004,"unknown_od":31149,"unknown_pu":11248},{"exclusions":{"bad_distance":18321,"bad_duration":41124,"implausible_speed":100,"nonpositive_duration":1089,"null_timestamp":0,"ts_out_of_month":9},"kept":3453646,"kept_known_od":3421971,"month":4,"raw_rows":3514289,"service":"yellow","trip_time_mismatch_gt60s":0,"unknown_do":26980,"unknown_od":31675,"unknown_pu":10586},{"exclusions":{"bad_distance":20046,"bad_duration":44303,"implausible_speed":152,"nonpositive_duration":1147,"null_timestamp":0,"ts_out_of_month":33},"kept":3658152,"kept_known_od":3623667,"month":5,"raw_rows":3723833,"service":"yellow","trip_time_mismatch_gt60s":0,"unknown_do":29299,"unknown_od":34485,"unknown_pu":11494},{"exclusions":{"bad_distance":23839,"bad_duration":43155,"implausible_speed":154,"nonpositive_duration":1140,"null_timestamp":0,"ts_out_of_month":51},"kept":3470854,"kept_known_od":3436628,"month":6,"raw_rows":3539193,"service":"yellow","trip_time_mismatch_gt60s":0,"unknown_do":29180,"unknown_od":34226,"unknown_pu":11125},{"exclusions":{"bad_distance":19567,"bad_duration":42074,"implausible_speed":211,"nonpositive_duration":1068,"null_timestamp":0,"ts_out_of_month":47},"kept":3013936,"kept_known_od":2982036,"month":7,"raw_rows":3076903,"service":"yellow","trip_time_mismatch_gt60s":0,"unknown_do":27375,"unknown_od":31900,"unknown_pu":9279},{"exclusions":{"bad_distance":28250,"bad_duration":42749,"implausible_speed":200,"nonpositive_duration":1018,"null_timestamp":0,"ts_out_of_m